{
  "active_goals": [
    "ship the Ai-Personalization_Kernel executable core with real enforcement, not stubs",
    "keep the CI regression gate green",
    "expand the correction ledger as new failures are discovered",
    "wire the Supabase canonical ledger through the connector plane (Phase E)"
  ],
  "continuity_state": {
    "active_project": "GlacierEQ/Ai-Personalization_Kernel",
    "last_verified_frontier": "deterministic seed generator + Supabase connector plane + CI drift gate",
    "open_blockers": []
  },
  "correction_refs": [
    "answer_before_context_recovery",
    "stale_state_reopening",
    "unnecessary_clarification_loop",
    "source_authority_inversion",
    "premature_answering_invariant_breach"
  ],
  "epistemic_preferences": [
    "prefers source-bearing evidence over unsupported summaries",
    "requires exact quotations and provenance for claims",
    "distinguishes observation from inference",
    "expects live provider readback before status claims",
    "skeptical of hallucinated citations"
  ],
  "expertise": [
    "python",
    "typescript",
    "distributed systems",
    "policy engines",
    "test-driven development",
    "git workflows"
  ],
  "identity": {
    "domains": [
      "software_architecture",
      "distributed_systems",
      "developer_tooling",
      "ai_agent_systems"
    ],
    "expertise_level": "senior",
    "operating_environment": "polyglot repos, CLI-first, CI/CD gated",
    "role": "Forward-deployed software architect / AI systems integrator"
  },
  "interaction_preferences": [
    "context first, hard work second, answer last",
    "do not ask for information that can be retrieved",
    "execute rather than merely describe",
    "preserve valid prior work",
    "avoid repetitive caveats",
    "do not flatten complex cumulative systems"
  ],
  "interest_weights": {
    "ai_agent_systems": 0.9,
    "developer_tooling": 0.93,
    "physics": 0.95,
    "software_architecture": 0.99,
    "television": 0.15,
    "testing_and_verification": 0.88
  },
  "output_preferences": [
    "structured output with deep hierarchy",
    "concise status after execution, not before",
    "polished external deliverables",
    "direct artifact links",
    "exact source anchors where necessary"
  ],
  "prohibitions": [
    "ask_user_to_repeat_known_info",
    "answer_before_context_recovery",
    "invent_approval_gates",
    "treat_assistant_heuristics_as_project_authority",
    "replace_operator_meaning_with_generic_wording",
    "collapse_polycentric_structures_into_one_canonical_replacement",
    "restart_known_work"
  ],
  "strategic_preferences": [
    "maximum coherent progress",
    "recover before recreating",
    "continue before reconstructing",
    "compound before replacing",
    "repair forward",
    "use tools and connectors aggressively when they create real progress"
  ],
  "strategy_refs": [
    "ongoing_repository_work",
    "context_first_execution"
  ]
}
